style,period_label,year_start,year_end,doc_file,section_label
Gothic Revival,1848–1906,1848,1906,Early%20Settlement%20Era%20Styles%20(1848-1906)_Adopted_2025.pdf,Evaluation Criteria: Gothic Revival
Italianate,c.1860–1885,1860,1885,Victorian%20Era%20Historic%20Context%20Statement.pdf,Evaluation Criteria: Italianate
Second Empire,c.1865–1885,1865,1885,Victorian%20Era%20Historic%20Context%20Statement.pdf,Evaluation Criteria: Second Empire
Stick/Eastlake,c.1860–1890,1860,1890,Victorian%20Era%20Historic%20Context%20Statement.pdf,Evaluation Criteria: Stick/Eastlake
Queen Anne,c.1880–1910,1880,1910,Victorian%20Era%20Historic%20Context%20Statement.pdf,Evaluation Criteria: Queen Anne
Art Deco,1925–c.1936,1925,1936,Modernistic%20Styles%20Historic%20Context%20Statement.pdf,Evaluation Criteria: Art Deco
Streamline Moderne,1935–1950,1935,1950,Modernistic%20Styles%20Historic%20Context%20Statement.pdf,Evaluation Criteria: Streamline Moderne
International Style,1935–1965,1935,1965,Modernistic%20Styles%20Historic%20Context%20Statement.pdf,Evaluation Criteria: International Style